suggested_action,risk_segment,priority_level,assigned_customer_count,observed_evidence,expected_mechanism,suggested_success_metric
Monitor only,Low Risk,Monitor,478,Limited support-service adoption,Observe risk movement without intervention cost.,Risk-segment migration and observed churn rate
Contract-upgrade incentive,High Risk,Priority 2,415,Tenure of 12 months or less,Encourage a longer commitment while reducing avoidable switching friction.,Contract conversion rate and 90-day retained rate
Targeted retention email,Medium Risk,Priority 3,223,Electronic-check payment,Use a lower-cost channel to test engagement before direct outreach.,Email engagement and 90-day retained rate
Contract-upgrade incentive,High Risk,Priority 1,220,Tenure of 12 months or less,Encourage a longer commitment while reducing avoidable switching friction.,Contract conversion rate and 90-day retained rate
Technical-support outreach,High Risk,Priority 2,41,Fiber-optic internet service,Reduce unresolved service and support friction.,Support activation and 90-day retained rate
Payment-method assistance,High Risk,Priority 2,12,Electronic-check payment,Reduce payment-process friction and offer a more stable payment option.,Payment-method change and 90-day retained rate
Retention call,High Risk,Priority 2,11,Fiber-optic internet service,Review needs and service friction with the customer.,Contact rate and 90-day retained rate
Onboarding support outreach,High Risk,Priority 2,9,Tenure of 12 months or less,Resolve early-life experience gaps before disengagement increases.,Outreach completion and 90-day retained rate
